<!DOCTYPE trial SYSTEM "reclac.dtd">
<!--a realistic and valid RECLAC trial XML-->
<!--based on data from the ANZCTR trial ACTRN12610000133033-->
<!--source: http://www.anzctr.org.au/trial_view.aspx?ID=335059-->
<trial type="interventional">
    <trial_identification>
  	<!--TRDS 10a (1)-->
        <scientific_title>Behavioral analysis of preterm neonates included in a tactile and kinesthetic stimulation program during hospitalization in preterm neonates</scientific_title>
	<!--TRDS 10b (0-1)-->
        <scientific_acronym>BATIK</scientific_acronym>
	<!--TRDS 9a (0-1)-->
	<public_title>Tactile and kinesthetic stimulation program during hospitalization and behavioral analysis in preterm neonates</public_title>
	<!--TRDS 9b (0-1)-->
        <acronym>TAKS</acronym>
	<!--TRDS 3a/3b (0-1)-->
	<utn>U9999-9999-0102</utn>
	<!--TRDS 1 (0-1)-->
	<reclac_id>RBR-9zz-2bc</reclac_id>
	<secondary_ids>
	    <secondary_id>
		<!--TRDS 3a (0-N)-->
		<sec_id>ACTRN12610000133033</sec_id>
		<!--TRDS 3b (0-N)-->
		<issuing_authority>ANZCTR</issuing_authority>
	    </secondary_id>
	</secondary_ids>
    </trial_identification>
    <sponsors_and_support>
	<!--TRDS 5 (1)-->
	<primary_sponsor country_code="BR">
	    <name>Universidade de São Paulo</name>
	    <address>
		Rua Prof. Mello Moraes, 1721
		Cidade Universitaria
		Sao Paulo, SP, CEP 055508-900
	    </address>
	</primary_sponsor>
	<!--TRDS 6 (0..*)-->
	<secondary_sponsor country_code="BR">
	    <name>Andreia Menandro Ferreira</name>
	    <address>
		Rua Cônego Valadão, 1539, apt 53
		Gopouva,
		Guarulhos, SP, CEP 07040-000
	    </address>
	</secondary_sponsor>
	<!--TRDS 4 (0..*)-->
	<source_support country_code="BR">
	    <name>Conselho Nacional de Desenvolvimento Cientifico e Tecnologico</name>
	    <address>
		SEPN 507 Ed. CNPq - Terreo - Sala 7
		Brasília, DF, CEP 70740-901
	    </address>
	</source_support>
    </sponsors_and_support>
    <health_conditions>
        <!--TRDS 12a (0..1)-->
	<freetext>preterm neonates</freetext>
        <!--TRDS 12b (0..*)-->
	<hc_code vocabulary="decs" version="2009">M01.060.703.520</hc_code>
        <!--TRDS 12c (0..*)-->
	<keyword vocabulary="decs">C13.703.420.491.500</keyword>
    </health_conditions>
    <interventions>
        <!--TRDS 13a (0..1)-->
	<freetext>
	Stable preterm neonates received tactile and kinesthetic stimulation
	during hospitalization; by trained author and mothers. With ligth
	touch and arms and legs mobilization; during 5 to 15 minutes daily,
	since preterm was clinically stable until hospital discharge.
	</freetext>
        <!--TRDS 13b (0..*)-->
	<i_code value="behavioural" />
        <!--TRDS 13c (0..*)-->
	<keyword vocabulary="decs" version="2009">F02.830.816.850</keyword>
    </interventions>
    <recruitment study_status="completed">
        <!--TRDS 11 (1+)-->
        <recruitment_country value="BR" />
        <!--TRDS 14a (1)-->
	<inclusion_criteria>
    	    Stable preterm infants weighing &lt; 2500 grams, with no significant perinatal asphyxia.
	</inclusion_criteria>
        <!--TRDS 14b (0..1)-->
	<gender value="both" />
        <!--TRDS 14c (0..1)-->
	<agemin unit="weeks">31</agemin>
        <!--TRDS 14d (0..1)-->
	<agemax unit="weeks">36</agemax>
        <!--TRDS 14e (0..1)-->
	<exclusion_criteria>
	    Vision and/or hear disfuction; neurological problems; instable preterms; without family autorization.
	</exclusion_criteria>
        <!--TRDS 16 (1)-->
	<date_enrolment_anticipated>2004-10-01</date_enrolment_anticipated>
        <!--TRDS 16 (1)-->
	<date_enrolment_actual>2004-10-01</date_enrolment_actual>
        <!--TRDS 17 (1)-->
	<target_size>32</target_size>
    </recruitment>
    <study_type>
        <!--TRDS 15b (1)-->
        <study_design expanded_access_program="no"
		      purpose="prevention"
		      intervention_assignment="parallel"
		      number_of_arms="2"
		      masking="open"
		      allocation="non-randomized-controlled">
	    Thirty-two clinically stable preterm infants weighing &lt; 2500
	    grams, with no significant perinatal asphyxia, were allocated to
	    two groups: a control group (CG) in which no intervention was made
	    (n=16) and a study group (SG) in which the newborn infants received
	    tactile and kinesthetic stimulation (n=16). Data on the infants’
	    clinical progress were collected from medical charts and behavioral
	    evaluations were carried out using a series of weekly, 8-minute
	    films recorded from study admission until hospital discharge.
	</study_design>
	<study_endpoint value="safety" />
	<study_endpoint value="efficacy" />
	<study_endpoint value="bioequivalence" />
	<study_endpoint value="biodisponibility" />
	<study_endpoint value="pharmacokinetics" />
	<study_endpoint value="pharmacodynamics" />
	<study_endpoint value="pharmacogenetics" />
        <!--TRDS 15c (1)-->
	<phase value="1-2" />
    </study_type>
    <outcomes>
        <!--TRDS 19 (1..*)-->
	<primary_outcome>
	    Predominance of self-regulated behavior in Behavioral Scale
	    (adapted from Neonatal Behavioral Assessment Scale NBAS).
	    Timepoint: every week, at least one week after beggining of
	    stimulation until hospital discharge.
	</primary_outcome>
        <!--TRDS 20 (1..*)-->
	<secondary_outcome>
	    Shorter duration of hospital stay.
	    Timepoint: after hospitalization.
	</secondary_outcome>
    </outcomes>
    <contacts>
        <!--TRDS 7 (1..*)-->
	<public_contact persons="p1"/>
        <!--TRDS 8 (1..*)-->
	<scientific_contact persons="p1"/>
	<person pid="p1" country_code="BR">
	    <firstname>Andreia</firstname>
	    <middlename>Menandro</middlename>
	    <lastname>Ferreira</lastname>
	    <address>
		Rua Cônego Valadão, 1539, apt 53
		Gopouva
	    </address>
	    <city>Guarulhos, SP</city>
	    <zip>07040-000</zip>
	    <telephone>+55 (11) 2422-7034</telephone>
	    <email>andreiamdeia@yahoo.com</email>
	    <affiliation>Universidade de São Paulo</affiliation>
	</person>
    </contacts>
    <references>
	<link url="http://www.anzctr.org.au/trial_view.aspx?ID=335059">
	    Original trial record at ANZCTR
	</link>
    </references>
</trial>
